index,Textstelle,Metapher,Kandidat,Nein,Metapher?,Fokus,Rahmen,Annotator,orig
551,"Doch macht das Wort ‚Chaos‘ vielleicht allzu sehr mit, was aus Mythen und Kosmogonien vertraut ist, als wären diese Fossilien der Menschheitsgeschichte.",0,4,0,Metaphernkandidat,"[nan, nan, nan, nan]","[nan, nan, nan, nan]","['T', 'P', 'B', 'GoldStandard']","Doch macht das Wort ‚Chaos‘ vielleicht allzu sehr mit, was aus Mythen und Kosmogonien vertraut ist, als wären diese Fossilien der Menschheitsgeschichte."
552,"Dort hatte ich es aber unterlassen, für die Erscheinung des ersten organisierten Zusammenhaltens von Menschen irgend einen so zusagen handgreiflichen Grund anzugeben denn so fest es einerseits steht, daß das soziale Leben Werk des menschlichen Geistes ist, so spekulativ und willkürlich wäre die Angabe eines positiven Grundes für jene Tat des Geistes wenn man geneigt ist auch hier die Lehre vom Kampfe ums Dasein in Anspruch zu nehmen, so mache ich vielmehr darauf aufmerksam, daß da die ursprüngliche Allgleichheit eine schöne Fabel ist und da die Organisation monarchisch oder aristokratisch bewerkstelligt wurde, ein Prinzip des Daseinskampfes nach außen als der Schöpfer des sozialen Lebens nicht einmal vermutet werden darf.",0,4,0,Metaphernkandidat,"[nan, nan, nan, nan]","[nan, nan, nan, nan]","['P', 'K', 'B', 'GoldStandard']","Dort hatte ich es aber unterlassen, für die Erscheinung des ersten organisierten Zusammenhaltens von Menschen irgend einen so zusagen handgreiflichen Grund anzugeben; denn so fest es einerseits steht,  daß das soziale Leben Werk des menschlichen Geistes ist, so spekulativ und willkürlich wäre die Angabe eines positiven Grundes für jene Tat des Geistes: wenn man geneigt ist auch hier die Lehre vom Kampfe ums Dasein in Anspruch zu nehmen, so mache ich vielmehr darauf aufmerksam, daß da die ursprüngliche Allgleichheit eine schöne Fabel ist und da die Organisation monarchisch oder aristokratisch bewerkstelligt wurde, ein Prinzip des Daseinskampfes nach außen als der Schöpfer des sozialen Lebens nicht einmal vermutet werden darf."
553,"Dort war nur gesagt, die Religion sei deshalb für das politische Leben bedeutsam, weil sie den Willen des Einzelnen unter die Weisungen einer sichtbaren oder unsichtbaren Macht beuge aber noch weit wirksamer als die Furcht vor der Gottheit, zu gleicher Zeit weit wirksamer, als die eben erwähnte Rücksicht auf das Urteil der Mitlebenden, und dazu noch eine bedeutende Steigerung von dem Wert des eigenen Ichs ist eine solche optimistische Weltauffassung, die dem Einzelnen erlaubt, sich als Schätzung einer allmächtigen Gottheit, oder als Mittel für die Zwecke einer aufwärtssteigenden Welteutwicklung zu fassen, mit den Worten des Neuen Testaments ausgedrückt, als Baustein zur Auferbauung des Reiches Gottes.",0,4,0,Metaphernkandidat,"[nan, nan, nan, nan]","[nan, nan, nan, nan]","['T', 'P', 'B', 'GoldStandard']","Dort war nur gesagt, die Religion sei deshalb für das politische Leben bedeutsam, weil sie den Willen des Einzelnen unter die Weisungen einer sichtbaren oder unsichtbaren Macht beuge; aber noch weit wirksamer als die Furcht vor der Gottheit, zu gleicher Zeit weit wirksamer, als die eben erwähnte Rücksicht auf das Urteil der Mitlebenden, und dazu noch eine bedeutende Steigerung von dem Wert des eigenen Ichs ist eine solche optimistische Weltauffassung, die dem Einzelnen erlaubt, sich als Schätzung einer allmächtigen Gottheit, oder als Mittel für die Zwecke einer aufwärtssteigenden Welteutwicklung zu fassen, mit den Worten des Neuen Testaments ausgedrückt, als Baustein zur Auferbauung des Reiches Gottes."
554,"Du wirst verbürgern, nicht Diener des Geistes, sondern Knecht des Geldes sein, jetzt und immer.",1,4,0,Metaphernkandidat,"[nan, nan, nan, 'Knecht', nan]","[nan, nan, nan, 'des Geldes', nan]","['K', 'P', 'B', 'A', 'GoldStandard']","Du wirst verbürgern, nicht Diener des Geistes, sondern Knecht des Geldes sein, jetzt und immer."
555,"Durch Stipendien unterstützt, absolvierte der junge Mann das Gymnasium und studierte Philologie.",0,2,0,,"[nan, nan]","[nan, nan]","['P', 'B']","Durch Stipendien unterstützt, absolvierte der junge Mann das Gymnasium und studierte Philologie."
556,"Durch unser klassifizierendes Denken haben wir in den Haushalt der Natur, der unseren Vorfahren, den Fetischanbetern noch heilloser Wirrwarr, willkürlicher Chaos war, Ordnung, Plan, Zusammenhang System und zuletzt Gesetzmäßigkeit gebracht oder wenigstens gedeutet.",1,3,0,Metaphernkandidat,"[nan, nan, 'Haushalt', nan]","[nan, nan, 'der Natur', nan]","['B', 'P', 'T', 'GoldStandard']","Durch unser klassifizierendes Denken haben wir in den Haushalt der Natur, der unseren Vorfahren, den Fetischanbetern noch heilloser Wirrwarr, willkürlicher Chaos war, Ordnung, Plan, Zusammenhang System und zuletzt — Gesetzmäßigkeit gebracht oder wenigstens gedeutet."
557,Ein Prinz würde bei der Wahl seiner Braut besser seiner Neigung folgen und auch auf die körperliche und geistige Gesundheit der Braut und ihrer Familie in höherem Maße achten können.,0,2,0,,"[nan, nan]","[nan, nan]","['P', 'B']",Ein Prinz würde bei der Wahl seiner Braut besser seiner Neigung folgen und auch auf die körperliche und geistige Gesundheit der Braut und ihrer Familie in höherem Maße achten können.
558,Ein unpatriotisches Parlament ist eine unsinnige Einrichtung.,0,2,0,,"[nan, nan]","[nan, nan]","['P', 'B']",Ein unpatriotisches Parlament ist eine unsinnige Einrichtung.
559,"Entweder Sozialismus, Stillstand und eventuell Rückgang, oder fortschreitende Differenzierung mit Zertrümmerung des Sozialismus und siegreichem Fortschritt.",0,4,0,Metaphernkandidat,"[nan, nan, nan, nan]","[nan, nan, nan, nan]","['B', 'P', 'T', 'GoldStandard']","Entweder Sozialismus, Stillstand und eventuell Rückgang, oder fortschreitende Differenzierung mit Zertrümmerung des Sozialismus und siegreichem Fortschritt."
560,"Er besagt, daß in der geschichtlichen Kulturwelt des Menschen die Dinge andere Wertigkeiten für Aufmerksamkeit und Lebensdistanz besitzen, als in der objektiven Gegenstandswelt der exakten Wissenschaften, deren subjektive Wertbesetzung von thematisierten Phänomenen der Norm und Tendenz nach auf Null geht. … In der Bedeutsamkeit kann die subjektive Komponente zwar größer sein als die objektive, die objektive aber nie auf Null zurückgehen.",0,4,0,Metaphernkandidat,"[nan, nan, nan, nan]","[nan, nan, nan, nan]","['T', 'P', 'B', 'GoldStandard']","Er besagt, daß in der geschichtlichen Kulturwelt des Menschen die Dinge andere Wertigkeiten für Aufmerksamkeit und Lebensdistanz besitzen, als in der objektiven Gegenstandswelt der exakten Wissenschaften, deren subjektive Wertbesetzung von thematisierten Phänomenen der Norm und Tendenz nach auf Null geht. […]
 In der Bedeutsamkeit kann die subjektive Komponente zwar größer sein als die objektive, die objektive aber nie auf Null zurückgehen."
561,"Er lernt sogar die Sprache der Menschen verstehen und kann auch durch Worte seine Gedanken kund geben, wenn man ihm die Möglichkeit gibt, durch Klopfen Buchstaben zu bezeichnen.",0,2,0,,"[nan, nan]","[nan, nan]","['P', 'B']","Er lernt sogar die Sprache der Menschen verstehen und kann auch durch Worte seine Gedanken kund geben, wenn man ihm die Möglichkeit gibt, durch Klopfen Buchstaben zu bezeichnen."
562,"Er war insofern klarer als die Marxistische Sozialdemokratie, als er an die bestehenden Verhältnisse anknüpfte.",0,2,0,,"[nan, nan]","[nan, nan]","['P', 'B']","Er war insofern klarer als die Marxistische Sozialdemokratie, als er an die bestehenden Verhältnisse anknüpfte."
563,Es das Erschrecken vor dem Affenbrotbaum hat als solches seine subjektive Verwirrungsfunktion verloren.,0,4,0,Metaphernkandidat,"[nan, nan, nan, nan]","[nan, nan, nan, nan]","['T', 'P', 'B', 'GoldStandard']",Es [das Erschrecken vor dem Affenbrotbaum] hat als solches seine subjektive Verwirrungsfunktion verloren.
564,"Es ist die Vergangenheit eines Königs, was sich unheilvoll entbirgt, nicht die verhehlte Wunschunterwelt eines ‚psychischen Apparats‘.",1,3,0,Metaphernkandidat,"['Wunschunterwelt', nan, nan, nan]","[nan, nan, nan, nan]","['T', 'P', 'B', 'GoldStandard']","Es ist die Vergangenheit eines Königs, was sich unheilvoll entbirgt, nicht die verhehlte Wunschunterwelt eines ‚psychischen Apparats‘."
565,"Es ist ein undurchführbarer Plan, die Verschiedenheit der Vorbildung aufheben zu wollen.",0,2,0,,"[nan, nan]","[nan, nan]","['P', 'B']","Es ist ein undurchführbarer Plan, die Verschiedenheit der Vorbildung aufheben zu wollen."
566,"Es ist falsch, wenn Marx die Geschichte als eine fortgesetzte Umwandlung der menschlichen Natur bezeichnet.",0,2,0,,"[nan, nan]","[nan, nan]","['B', 'P']","Es ist falsch, wenn Marx die Geschichte als ""eine fortgesetzte Umwandlung der menschlichen Natur"" bezeichnet."
567,"Es ist nicht ein Nullpunkt der Selbstermannung der Vernunft, dem wir im dunklen Wort des Thales beiwohnen, sondern die Wahrnehmung einer langhin errungenen Freisetzung des Weltzuschauers.",0,4,0,Metaphernkandidat,"[nan, 'Selbstermannung', nan, nan]","[nan, nan, nan, nan]","['T', 'P', 'B', 'GoldStandard']","Es ist nicht ein Nullpunkt der Selbstermannung der Vernunft, dem wir im dunklen Wort des Thales beiwohnen, sondern die Wahrnehmung einer langhin errungenen Freisetzung des Weltzuschauers."
568,"Es ist nur eine Partikel im Strom der großen Rückkehr, die das Leben im ganzen – als der episodische Ausnahmezustand der energetischen Entropie – durchmacht.",3,1,0,Metapher,"['Strom der Rückkehr', nan, 'Strom der großen Rückkehr', 'Strom der großen Rückkehr']","[nan, nan, nan, nan]","['T', 'P', 'B', 'GoldStandard']","Es ist nur eine Partikel im Strom der großen Rückkehr, die das Leben im ganzen – als der episodische Ausnahmezustand der energetischen Entropie – durchmacht."
569,"Es ist selbstverständlich daß von zwei Nationen caeteris paribus die jenige in dem allgemeinen Wettbewerb den Vorteil haben wird, welche das größere moderne Wissen besitzt aber das Wissen muß ein praktisches sein und den Forderungen der Zeit entsprechen. Kwledge s power, aber nur, wenn es das lebendige Wissen unserer heutigen Zivilisation repräsentiert und nicht das versteinerte, in die Museen gehörige Leben längst vergangener Zeiten Man möge ja nicht glauben, daß ich das Studium der alten Sprachen und Klassiker für Alle verwerfe, denn dieses ist durchaus nicht der Fall.",1,3,0,Metaphernkandidat,"[nan, nan, 'versteinerte', nan]","[nan, nan, 'Wissen', nan]","['B', 'T', 'P', 'GoldStandard']","Es ist selbstverständlich daß von zwei Nationen (caeteris paribus) die jenige in dem allgemeinen Wettbewerb den Vorteil haben wird, welche das größere moderne Wissen besitzt; aber das Wissen muß ein praktisches sein und den Forderungen der Zeit entsprechen. »Kwledge s power«, aber nur, wenn es das lebendige Wissen unserer heutigen Zivilisation repräsentiert und nicht das versteinerte, in die Museen gehörige Leben längst vergangener Zeiten« Man möge ja nicht glauben, daß ich das Studium der alten Sprachen und Klassiker für Alle verwerfe, denn dieses ist durchaus nicht der Fall."
570,"Es ist weder zufällig, daß unsere höchste Kunst eine intime und keine monumentale ist, noch daß heute nur innerhalb der kleinsten Gemeinschaftskreise, von Mensch zu Mensch, im pianissimo, jenes Etwas pulsiert, das dem entspricht, was früher als prophetisches Pneuma in stürmischem Feuer durch die großen Gemeinden ging und sie zusammenschweißte.",0,5,0,Metaphernkandidat,"[nan, nan, nan, nan, nan]","[nan, nan, nan, nan, nan]","['K', 'P', 'B', 'A', 'GoldStandard']","Es ist weder zufällig, daß unsere höchste Kunst eine intime und keine monumentale ist, noch daß heute nur innerhalb der kleinsten Gemeinschaftskreise, von Mensch zu Mensch, im pianissimo, jenes Etwas pulsiert, das dem entspricht, was früher als prophetisches Pneuma in stürmischem Feuer durch die großen Gemeinden ging und sie zusammenschweißte."
571,"Es kann kein Zweifel darüber bestehen, daß zur Beurteilung politischer Fragen sowohl geschichtliche als auch geographische und wirtschaftspolitische Kenntnisse nötig sind ob solche bei allen Abgeordneten in genügendem Maße vorhanden sind, kann mit gutem Grund bezweifelt werden.",0,2,0,,"[nan, nan]","[nan, nan]","['P', 'B']","Es kann kein Zweifel darüber bestehen, daß zur Beurteilung politischer Fragen sowohl geschichtliche als auch geographische und wirtschaftspolitische Kenntnisse nötig sind; ob solche bei allen Abgeordneten in genügendem Maße vorhanden sind, kann mit gutem Grund bezweifelt werden."
572,"Es mag noch ein weiterer Schritt zur Konstruktion des Sachverhalts sein, sich den Absolutismus der Wünsche und Bilder als Ausgeburten der Höhle zunächst in der Isolation vom Absolutismus der Wirklichkeit vorzustellen.",2,2,0,Metaphernkandidat,"['Ausgeburten der Höhle', 'Ausgeburt der Höhle', nan, nan]","[nan, nan, nan, nan]","['T', 'P', 'B', 'GoldStandard']","Es mag noch ein weiterer Schritt zur Konstruktion des Sachverhalts sein, sich den Absolutismus der Wünsche und Bilder als Ausgeburten der Höhle zunächst in der Isolation vom Absolutismus der Wirklichkeit vorzustellen."
573,"Es sei stark genug, seine eigenen politischen und wirtschaftlichen Ziele zu verfolgen, und es sei Zeit, kräftig die Axt an die Wurzel des zopftrockenen Stammes der Schutzzölle zu legen. Wie man sieht, nichts wie nichtssagende Tiraden und nicht ein einziges fachverftändiges Wort über die Produktionskosten der zu ermäßigenden Artikel in Deutschland und im Auslande.",1,3,0,Metaphernkandidat,"[nan, nan, 'die Axt an die Wurzel des zopftrockenen Stammes', nan]","[nan, nan, 'der Schutzzölle', nan]","['T', 'P', 'B', 'GoldStandard']","Es sei stark genug, seine eigenen politischen und wirtschaftlichen Ziele zu verfolgen, und es sei Zeit, kräftig die Axt an die Wurzel des zopftrockenen Stammes der Schutzzölle zu legen.«  Wie man sieht, nichts wie nichtssagende Tiraden und nicht ein einziges fachverftändiges Wort über die Produktionskosten der zu ermäßigenden Artikel in Deutschland und im Auslande."
574,"Es war ein Situationssprung, der den unbesetzten Fernhorizont zur dauernden Gewärtigung des bis dahin Unbekannten machte.",1,3,0,Metaphernkandidat,"['Situationssprung', nan, nan, nan]","[nan, nan, nan, nan]","['T', 'P', 'B', 'GoldStandard']","Es war ein Situationssprung, der den unbesetzten Fernhorizont zur dauernden Gewärtigung des bis dahin Unbekannten machte."
575,Es wurde der Tummelplatz der Nationen.,0,4,0,Metaphernkandidat,"[nan, nan, nan, nan]","[nan, nan, nan, nan]","['B', 'T', 'P', 'GoldStandard']",Es wurde der Tummelplatz der Nationen.
576,"Es wurde ein neuer Reichskanzler nach dem Sinne der Reichstagsmehrheit ernannt und ein neues Ministerium gebildet, welches größtenteils aus Abgeordneten der Mehrheitsparteien besteht.",0,2,0,,"[nan, nan]","[nan, nan]","['P', 'B']","Es wurde ein neuer Reichskanzler nach dem Sinne der Reichstagsmehrheit ernannt und ein neues Ministerium gebildet, welches größtenteils aus Abgeordneten der Mehrheitsparteien besteht."
577,"Feiglinge zu Hause, aber Löwen der übrigen Welt gegenüber.",0,4,0,Metaphernkandidat,"[nan, nan, nan, nan]","[nan, nan, nan, nan]","['P', 'T', 'B', 'GoldStandard']","Feiglinge zu Hause, aber Löwen der übrigen Welt gegenüber."
578,"Ferner haben wir gesehen, daß wir dem europäischen Typus den Wert und den Namen einer eigenen Rasse beizulegen berechtigt sind, weil er seine physischen und psy Organismen und Staaten.  chischen Merkmale mit hinreichender Konstanz vererbt, dergestalt, daß sich diese Rasse nach allen Erdteilen verpflanzt und überall ihre Eigenart zu sichern vermag.",0,4,0,Metaphernkandidat,"[nan, nan, nan, nan]","[nan, nan, nan, nan]","['B', 'P', 'T', 'GoldStandard']","Ferner haben wir gesehen, daß wir dem europäischen Typus den Wert und den Namen einer eigenen Rasse beizulegen berechtigt sind, weil er seine physischen und psy             Organismen und Staaten. 117  chischen Merkmale mit hinreichender Konstanz vererbt, dergestalt, daß sich diese Rasse nach allen Erdteilen verpflanzt und überall ihre Eigenart zu sichern vermag."
579,"Folgt man der Konstruktion eines genuinen Absolutismus der Wirklichkeit, so werden die von Otto namhaft gemachten Fluida des Mana, Orenda, Manitu und Wakanda am ehesten als Restbestände der ursprünglich die Erscheinungen der Welt umgebenden Aura von Übermacht und Unzugänglichkeit zu sehen sein.",0,4,0,Metaphernkandidat,"[nan, nan, nan, nan]","[nan, nan, nan, nan]","['T', 'P', 'B', 'GoldStandard']","Folgt man der Konstruktion eines genuinen Absolutismus der Wirklichkeit, so werden die von Otto namhaft gemachten Fluida des Mana, Orenda, Manitu und Wakanda am ehesten als Restbestände der ursprünglich die Erscheinungen der Welt umgebenden Aura von Übermacht und Unzugänglichkeit zu sehen sein."
580,Freud hat als den Kern der traumatischen Situation die völlige Hilflosigkeit des Ich vor überwältigender Gefahr beschrieben und in der frühkindlichen Liebesforderung die Kompensation solcher Hilflosigkeit gesehen.,0,4,0,Metaphernkandidat,"[nan, nan, nan, nan]","[nan, nan, nan, nan]","['T', 'P', 'B', 'GoldStandard']",Freud hat als den Kern der traumatischen Situation die völlige Hilflosigkeit des Ich vor überwältigender Gefahr beschrieben und in der frühkindlichen Liebesforderung die Kompensation solcher Hilflosigkeit gesehen.
581,Freud hat den Totalmythos nicht erfunden.,0,4,0,Metaphernkandidat,"[nan, nan, nan, nan]","[nan, nan, nan, nan]","['T', 'P', 'B', 'GoldStandard']",Freud hat den Totalmythos nicht erfunden.
582,"Freud ist aus der Sackgasse des Einheitsprinzips entschlossen ausgebrochen, um sich die Möglichkeit einer Geschichte offen zu halten – letztlich die Möglichkeit des Großen Mythos.",2,2,0,Metaphernkandidat,"['Sackgasse', nan, 'Sackgasse', nan]","[nan, nan, nan, nan]","['T', 'P', 'B', 'GoldStandard']","Freud ist aus der Sackgasse des Einheitsprinzips entschlossen ausgebrochen, um sich die Möglichkeit einer Geschichte offen zu halten – letztlich die Möglichkeit des Großen Mythos."
583,"Für das, was beim Tode Jesu geschah, leistet die äußerste Übertreibung erst Tertullian, der nicht nur als Jurist rhetorisch eifert, sondern seiner Affinität zum Weltschwund Ausdruck verschafft, wenn er die Passionsverfinsterung mit dem Titel des casus mundi belegt.",0,4,0,Metaphernkandidat,"[nan, nan, nan, nan]","[nan, nan, nan, nan]","['T', 'P', 'B', 'GoldStandard']","Für das, was beim Tode Jesu geschah, leistet die äußerste Übertreibung erst Tertullian, der nicht nur als Jurist rhetorisch eifert, sondern seiner Affinität zum Weltschwund Ausdruck verschafft, wenn er die Passionsverfinsterung mit dem Titel des casus mundi belegt."
584,"Gerade mit Rücksicht auf das Licht, welches vor der Deszendenztheorie auf diese vier wichtigen Probleme ausstrahlt, wollen wir unsere Untersuchung über die biologischen Grundlagen des Gesellschaftslebens bis zu dem Grenzgebiete allgemeinwissenschaftlicher Probleme ausdehnen, ohne indessen auf die Probleme selbst einzugehen.",0,4,0,Metaphernkandidat,"[nan, nan, nan, nan]","[nan, nan, nan, nan]","['T', 'B', 'P', 'GoldStandard']","Gerade mit Rücksicht auf das Licht, welches vor der Deszendenztheorie auf diese vier wichtigen Probleme ausstrahlt, wollen wir unsere Untersuchung über die biologischen Grundlagen des Gesellschaftslebens bis zu dem Grenzgebiete allgemeinwissenschaftlicher Probleme ausdehnen, ohne indessen auf die Probleme selbst einzugehen."
585,"Gewahrt man im Hintergrund der ganzen Götterdeszendenz das Chaos, den klaffenden Abgrund, der nur als Herkunftsort von unbekannter Wirkungsweise eingesetzt ist und folglich keinen Kult erhält, so sieht man Gestalten und Namen sich von dort her korrelativ formieren und an Deutlichkeit gewinnen.",0,4,0,Metaphernkandidat,"[nan, nan, nan, nan]","[nan, nan, nan, nan]","['T', 'P', 'B', 'GoldStandard']","Gewahrt man im Hintergrund der ganzen Götterdeszendenz das Chaos, den klaffenden Abgrund, der nur als Herkunftsort von unbekannter Wirkungsweise eingesetzt ist und folglich keinen Kult erhält, so sieht man Gestalten und Namen sich von dort her korrelativ formieren und an Deutlichkeit gewinnen."
586,"Hat aber die Abstammungslehre recht, so muß sie irgend eine Erklärung dafür beibringen, woher es kommt, daß die lückenlosen Übergänge von einer Form zur andern, die doch existiert haben müssen für unsere Kenntnis großenteils fehlen daß, wie auf der Klaviatur, die Zwischentöne fehlen und daß auch keine Violine da ist, um sie zum Ausdruck zu bringen Verschwinden der ausgestorbenen Typen schuld, die sich dort befunden haben müssen, wo jetzt für die Systematik die Brücken abgebrochen sind?",3,1,0,Metapher,"[nan, 'keine Violine da ist', 'keine Violine', ""['keine Violine', 'keine Violine da ist']""]","[nan, 'um sie zum Ausdruck zu bringen', 'lückenlosen Übergänge', ""['lückenlosen Übergänge', 'um sie zum Ausdruck zu bringen']""]","['B', 'P', 'T', 'GoldStandard']","Hat aber die Abstammungslehre recht, so muß sie irgend eine Erklärung dafür beibringen, woher es kommt, daß die lückenlosen Übergänge von einer Form zur andern, die doch existiert haben müssen für unsere Kenntnis großenteils fehlen; daß, wie auf der Klaviatur, die Zwischentöne fehlen und daß auch keine Violine da ist, um sie zum Ausdruck zu bringen Verschwinden der ausgestorbenen Typen schuld, die sich dort befunden haben müssen, wo jetzt für die Systematik die Brücken abgebrochen sind?"
587,"Heute ist die Empfindung gerade der Jugend wohl eher die umgekehrte Die Gedankengebilde der Wissenschaft sind ein hinterweltliches Reich von künstlichen Abstraktionen, die mit ihren dürren Händen Blut und saft des wirklichen Lebens einzufangen trachten, ohne es doch je zu erhaschen.",5,1,0,Metapher,"['mit ihren dürren Händen', 'mit ihren dürren Händen', 'Blut und saft', nan, 'Blut und saft', ""['mit ihren dürren Händen', 'mit ihren dürren Händen', 'Blut und saft', 'Blut und saft']""]","['Die Gedankengebilde der Wissenschaft', 'Die Gedankengebilde der Wissenschaft', 'des wirklichen Lebens', nan, 'des wirklichen Lebens einzufangen', ""['Die Gedankengebilde der Wissenschaft', 'Die Gedankengebilde der Wissenschaft', 'des wirklichen Lebens', 'des wirklichen Lebens einzufangen']""]","['K', 'P', 'P', 'B', 'A', 'GoldStandard']","Heute ist die Empfindung gerade der Jugend wohl eher die umgekehrte: Die Gedankengebilde der Wissenschaft sind ein hinterweltliches Reich von künstlichen Abstraktionen, die mit ihren dürren Händen Blut und saft des wirklichen Lebens einzufangen trachten, ohne es doch je zu erhaschen."
588,"Hier erst,, ist an die Stelle des frühen endogenen Mythologems das exogene – ein Verzweiflungsmittel für den unverzichtbaren Wahrheitsbedarf – getreten.",0,4,0,Metaphernkandidat,"[nan, nan, nan, nan]","[nan, nan, nan, nan]","['T', 'P', 'B', 'GoldStandard']","Hier erst, 1937, ist an die Stelle des frühen endogenen Mythologems das exogene – ein Verzweiflungsmittel für den unverzichtbaren Wahrheitsbedarf – getreten."
589,"Hier im Leben aber, in dem, was für Platon das schattenspiel an den Wänden der Höhle war, pulsiert die wirkliche Realität das andere sind von ihr abgeleitete und leblose Gespenster und sonst nichts.",5,2,0,Metapher,"[nan, 'pulsiert', nan, 'schattenspiel an den Wänden der Höhle', 'pulsiert', 'abgeleitete und leblose Gespenster', ""['pulsiert', 'schattenspiel an den Wänden der Höhle', 'pulsiert', 'abgeleitete und leblose Gespenster']""]","[nan, 'die wirkliche Realität', nan, 'Realität', 'Realität', 'Realität', ""['die wirkliche Realität', 'Realität', 'Realität', 'Realität']""]","['K', 'P', 'B', 'A', 'A', 'A', 'GoldStandard']","Hier im Leben aber, in dem, was für Platon das schattenspiel an den Wänden der Höhle war, pulsiert die wirkliche Realität: das andere sind von ihr abgeleitete und leblose Gespenster und sonst nichts."
590,"Hier zum erstenmal schien ein Mittel zur Hand, womit man jemanden in den logischen schraubstock setzen konnte, so daß er nicht herauskam, ohne zuzugeben entweder daß er nichts wisse oder daß dies und nichts anderes die Wahrheit sei, die ewige Wahrheit, die nie vergehen würde, wie das Tun und Treiben der blinden Menschen.",5,0,0,Metapher,"['in den logischen schraubstock setzen', 'logischen', 'schraubstock', 'in den logischen schraubstock setzen', ""['in den logischen schraubstock setzen', 'logischen', 'schraubstock', 'in den logischen schraubstock setzen']""]","['ein Mittel zur Hand, womit man jemanden', 'schraubstock', 'logischen', 'jemanden', ""['ein Mittel zur Hand, womit man jemanden', 'schraubstock', 'logischen', 'jemanden']""]","['K', 'P', 'B', 'A', 'GoldStandard']","Hier zum erstenmal schien ein Mittel zur Hand, womit man jemanden in den logischen schraubstock setzen konnte, so daß er nicht herauskam, ohne zuzugeben: entweder daß er nichts wisse: oder daß dies und nichts anderes die Wahrheit sei, die ewige Wahrheit, die nie vergehen würde, wie das Tun und Treiben der blinden Menschen."
591,"Hirtenstämme bevorzugen das Seniorat als politische Einrichtung, in dem der Älteste einer Gens oder eines Stammes an die Spitze des Ganzen tritt.",0,2,0,,"[nan, nan]","[nan, nan]","['B', 'P']","Hirtenstämme bevorzugen das Seniorat als politische Einrichtung, in dem der Älteste einer Gens oder eines Stammes an die Spitze des Ganzen tritt."
