index,Textstelle,Metapher,Kandidat,Nein,Metapher?,Fokus,Rahmen,Annotator,orig
336,"ist freilich nicht ganz passend für dieses ewige mörderische Ringen um das Dasein auf einem über die ganze Erde, ihre Meere und ihren Luftkreis ausgedehnten Kriegsschauplatz. Dieser gewaltige Daseinskampf, der den Siegern die Fortdauer in der Nachkommenschaft, den Unterliegenden das Erlöschen ihres Stammes bringt, hatte bis zu Darwin keinen einzigen aufmerksamen Zuschauer gehabt. Seit Darwin hat der Mensch den Vorzug, nicht nur Teilnehmer, sondern auch Beobachter dieses großen Kampfes zu sein. Diese ungewohnte Zuschauerrolle, die uns Darwin verschaffte, wäre ein recht zweifelhafter Gewinn, sofern es sich nur um die ästhetischen Eindrücke des Erschauten handelt denn ein Vergnügen ist es kaum, sich die unerbittliche Grausamkeit dieses endlosen Vernichtungskrieges der Natur gegen lebende Wesen und dieser unter sich vor Augen führeu zu lassen.",1,2,0,Metaphernkandidat,"[nan, 'endlosen Vernichtungskrieges der Natur', nan]","[nan, 'gegen lebende Wesen', nan]","['B', 'A', 'GoldStandard']"," ist freilich nicht ganz passend für dieses ewige mörderische Ringen um das Dasein auf einem über die ganze Erde, ihre Meere und ihren Luftkreis ausgedehnten Kriegsschauplatz. Dieser gewaltige Daseinskampf, der den Siegern die Fortdauer in der Nachkommenschaft, den Unterliegenden das Erlöschen ihres Stammes bringt, hatte bis zu Darwin keinen einzigen aufmerksamen Zuschauer gehabt. Seit Darwin hat der Mensch den Vorzug, nicht nur Teilnehmer, sondern auch Beobachter dieses großen Kampfes zu sein. Diese ungewohnte Zuschauerrolle, die uns Darwin verschaffte, wäre ein recht zweifelhafter Gewinn, sofern es sich nur um die ästhetischen Eindrücke des Erschauten handelt; denn ein Vergnügen ist es kaum, sich die drücke des Erschauten handelt; denn ein Vergnügen ist es kaum, sich die unerbittliche Grausamkeit dieses endlosen Vernichtungskrieges der Natur gegen lebende Wesen und dieser unter sich vor Augen führeu zu lassen."
337,"oder aber uns dieser unaufhaltsam daherrollenden Lawine des Guten in den Weg zu werfen, um von ihr zerschmettert zu werden.",5,0,0,Metapher,"['dieser unaufhaltsam daherrollenden Lawine', 'unaufhaltsam daherrollenden Lawine,zerschmettert werden', 'des Guten', 'unaufhaltsam daherrollende Lawine', nan]","['des Guten', 'des Guten', 'unaufhaltsam daherrollenden Lawine', 'des Guten', nan]","['B', 'A', 'P', 'K', 'GoldStandard']"," oder aber uns dieser unaufhaltsam daherrollenden Lawine des Guten in den Weg zu werfen, um von ihr zerschmettert zu werden."
338,"Beim Menschen scheint das Kind gar nichts mitzubringen, sondern alles erst zu lernen in der Tat aber bringt es alles oder doch unendlich viel mehr mit als das fix und fertig aus dem Ei kriechende Tier, aber es bringt alles in unreifem Zustande mit, weil des zu Entwickelnden bei ihm so viel ist, daß es in den  Monaten des Embryolebens nur erst im Keime vorgebildet sein kann.",0,4,0,,"[nan, nan, nan, nan]","[nan, nan, nan, nan]","['B', 'A', 'P', 'K']"," »Beim Menschen scheint das Kind gar nichts mitzubringen, sondern alles erst zu lernen; in der Tat aber bringt es alles oder doch unendlich viel mehr mit als das fix und fertig aus dem Ei kriechende Tier, aber es bringt alles in unreifem Zustande mit, weil des zu Entwickelnden bei ihm so viel ist, daß es in den 9 Monaten des Embryolebens nur erst im Keime vorgebildet sein kann."
339,"Die fortschreitende Gesellschaftsbilduug Civilisation ist das höchste Ergebnis der vervollkommnenden Auslese derämpfe genauer gesagt ist sie das unausbleibliche Produkt aller Daseinsund Interessenkämpfe, kämpfe, welche von den sozialen Einheiten jeder Entwickelungsstufe teils unter sich, teils gegen die äußere Natur, mit den wachsenden Mitteln der Menschlichen Geistes, Körperund Vermögensausstattung und innerhalb einer durch Recht und Sitte gesetzten Streitorganisation ausgekämpft, durch den Trieb individueller und kollektiver Selbsterhaltung, durch den organischen Vermehrungstrieb, durch den Eigennutz, durch gemeinnützige Verbesserungsbestrebungen erweckt und in immer höherem Grade erneuert, um die Befriedigung nicht bloß der sinnlichen Notdurft, sondern mehr und mehr um ein steigendes Maß höherer materieller und ideeller Lebensansprüche geführt, durch Zufall, durch Spiel, durch äußeren und inneren Krieg durch freien Austrag und durch vielgestaltige Urteilsinstanzen des Wettstreites entschieden werden und notwendig dahin führen daß im einzelnen die relativ besten Anpassungen sowohl angeregt als zur Herrschaft, Ausbreitung und Überlieferung gebracht, dagegen die relativ schlechtesten Anpassungen, die Entartungen und fremdartigen Bildungen vernichtet, abgestoßen oder zu besserer Anpassung genötigt werden, und daß im ganzen ein wachsendes Maß ideeller und materieller Kräfte für die kollektive Führung des menschlichen Daseinskampfes sich anhäuft, daß immer mehr GesellschaftsBildung, das heißt immer mehr Gliederung und Vereinigung der geistigen und physischen Arbeitskräfte, sowie der zugehörigen Güterausstattungen stattfindet.",1,4,0,Metaphernkandidat,"[nan, nan, nan, 'Streit-organisation ', nan]","[nan, nan, nan, 'durch Recht und Sitte', nan]","['B', 'A', 'P', 'K', 'GoldStandard']"," »Die fortschreitende Gesellschaftsbilduug (Civilisation) ist das höchste Ergebnis der vervollkommnenden Auslese der menschlichen Daseinskämpfe; genauer gesagt — ist sie das unausbleibliche Produkt aller Daseins- und Interessenkämpfe, kämpfe, welche von den sozialen Einheiten jeder Entwickelungsstufe teils unter sich, teils gegen die äußere Natur, mit den wachsenden Mitteln der Menschlichen Geistes-, Körperund Vermögensausstattung und innerhalb einer durch Recht und Sitte gesetzten Streit- und Vermögensausstattung und innerhalb einer durch Recht und Sitte gesetzten Streitorganisation ausgekämpft, organisation ausgekämpft, durch den Trieb individueller und kollektiver Selbsterhaltung, durch den organischen Vermehrungstrieb, durch den Eigennutz, durch gemeinnützige Verbesserungsbestrebungen erweckt und in immer höherem Grade erneuert, um die Befriedigung nicht bloß der sinnlichen Notdurft, sondern mehr und mehr um ein steigendes Maß höherer materieller und ideeller Lebensansprüche geführt, durch Zufall, durch Spiel, durch äußeren und inneren Krieg durch freien Austrag und durch vielgestaltige Urteilsinstanzen des Wettstreites entschieden werden und notwendig dahin führen: daß im einzelnen die relativ besten Anpassungen sowohl angeregt als zur Herrschaft, Ausbreitung und Überlieferung gebracht, dagegen die relativ schlechtesten Anpassungen, die Entartungen und fremdartigen Bildungen vernichtet, abgestoßen oder zu besserer Anpassung genötigt werden, und daß im ganzen ein wachsendes Maß ideeller und materieller Kräfte für die kollektive Führung des menschlichen Daseinskampfes sich anhäuft, daß immer mehr GesellschaftsBildung, das heißt immer mehr Gliederung und Vereinigung der geistigen und physischen Bildung, das heißt immer mehr Gliederung und Vereinigung der geistigen und physischen Arbeitskräfte, sowie der zugehörigen Güterausstattungen stattfindet.«"
340,"Diese gemmules, sagt Darwin, sammeln sich aus allen Teilen des Körpers, um die Geschlechtsstoffe sc. Keimzellen zusammenzusetzen und ihre Entwicklung in der nächsten Generation bildet ein neues Wesen aber sie sind gleicherweise auch fähig, in einem schlummernden Zustande an künftige Generationen überliefert und dann erst entwickelt zu werden.",2,2,0,,"['schlummernd', 'bildet ein neues Wesen', nan, nan]","['Zustande', 'Entwicklung', nan, nan]","['B', 'A', 'P', 'K']"," »Diese gemmules«, sagt Darwin2), »sammeln sich aus allen Teilen des Körpers, um die Geschlechtsstoffe« (sc. Keimzellen) »zusammenzusetzen und ihre Entwicklung in der nächsten Generation bildet ein neues Wesen; aber sie sind gleicherweise auch fähig, in einem schlummernden Zustande an künftige Generationen überliefert und dann erst entwickelt zu werden."
341,"Eine Gesellschaftsformation geht nie unter, sagt Marx, bevor alle Produktivkräfte entwickelt sind, für die sie weit genug ist, und neue höhere Produktionsverhältnisse treten nie an die Stelle, bevor die materiellen Existenzbedingungen derselben im Schoß der alten Gesellschaft selbst ausgebrütet worden sind.",5,0,0,Metapher,"['im Schoß selbst ausgebrütet worden', 'im Schoß ausgebrütet', 'Schoß,ausgebrütet worden sind', 'ausgebrütet ', 'im Schoß selbst ausgebrütet worden']","['die materiellen Existenzbedingungen', 'der alten Gesellschaft', 'der alten Gesellschaft,Schoß der GEsellschaft', 'im Schoß der alten Gesellschaft', 'der alten Gesellschaft']","['B', 'A', 'P', 'K', 'GoldStandard']"," »Eine Gesellschaftsformation geht nie unter«, sagt Marx1), »bevor alle Produktivkräfte entwickelt sind, für die sie weit genug ist, und neue höhere Produktionsverhältnisse treten nie an die Stelle, bevor die materiellen Existenzbedingungen derselben im Schoß der alten Gesellschaft selbst ausgebrütet worden sind.«"
342,"Es ist nun noch daran zu erinnern, daß vermöge der Gesetze der Vererbung und der Amphimixis d. i. der Verschmelzung der väterlichen und mütterlichen Keimzelle bei der geschlechtlichen Fortpflanzung in jedem Kinde der nämlichen Eltern wieder neue Kombinationen entstehen und dadurch eine fast unerschöpfliche Muster karte für die natürliche Auslese dargeboten wird.",5,0,0,Metapher,"['eine fast unerschöpfliche Musterkarte', 'unerschöpfliche Musterkarte', 'eine fast unerschöpfliche Musterkarte für die natürliche Auslese', 'fast unerschöpfliche Muster-karte', 'eine fast unerschöpfliche Musterkarte']","['für die natürliche Auslese', 'neue Kombinationen', 'daß in jedem Kinde der nämlichen Eltern dargeboten wird', 'für die natürliche Auslese', 'für die natürliche Auslese']","['B', 'A', 'P', 'K', 'GoldStandard']"," »Es ist nun noch daran zu erinnern, daß vermöge der Gesetze der Vererbung und der Amphimixis (d. i. innern, daß vermöge der Gesetze der Vererbung und der Amphimixis (d. i. der Verschmelzung der väterlichen und mütterlichen Keimzelle bei der geschlechtlichen Fortpflanzung) in jedem Kinde der nämlichen Eltern wieder schlechtlichen Fortpflanzung) in jedem Kinde der nämlichen Eltern wieder neue Kombinationen entstehen und dadurch eine fast unerschöpfliche Musterkarte für die natürliche Auslese dargeboten wird. karte für die natürliche Auslese dargeboten wird."
343,"In den deutschen Schutzgebieten besteht die Haussklaverei für die Eingeborenen weiter, und es ist bis jetzt nicht möglich gewesen, diese inhaltlich unrichtige Einrichtung zu beseitigen, weil man die Befürchtung hegt, mit einem dahingehenden Versuche gänzlich Schiffbruch zu leiden so auch noch Verordnung des Reichskanzlers von  XI. .",1,4,0,Metaphernkandidat,"[nan, 'Schiffsbruch zu erleiden', nan, nan, nan]","[nan, 'mit einem dahingehenden Versuche', nan, nan, nan]","['B', 'A', 'P', 'K', 'GoldStandard']"," »In den deutschen Schutzgebieten besteht die Haussklaverei für die Eingeborenen weiter, und es ist bis jetzt nicht möglich gewesen, diese inhaltlich unrichtige Einrichtung zu beseitigen, weil man die Befürchtung hegt, mit einem dahingehenden Versuche gänzlich Schiffbruch zu leiden (so auch noch Verordnung des Reichskanzlers von 29. XI. 1901)."
344,"In der Tat kann die Darwinistische Theorie, wenn sie ihren großartigen Kern, die einheitliche Entwickelungslehre, vollkommen entfalten will, in der menschlichen Gemeinschaftsbildung nur den Abschluß des großen synthetischen Entwickelungsprozesses erblicken, der die Elementarorganismen zu immer höheren und immer verwickelteren Organismen zusammenfügt! fügt!",0,5,0,Metaphernkandidat,"[nan, nan, nan, nan, nan]","[nan, nan, nan, nan, nan]","['B', 'A', 'P', 'K', 'GoldStandard']"," »In der Tat kann die Darwinistische Theorie, wenn sie ihren großartigen Kern, die einheitliche Entwickelungslehre, vollkommen entfalten will, in der menschlichen Gemeinschaftsbildung nur den Abschluß des großen synthetischen Entwickelungsprozesses erblicken, der die bildung nur den Abschluß des großen synthetischen Entwickelungsprozesses erblicken, der die Elementarorganismen zu immer höheren und immer verwickelteren Organismen zusammenfügt! fügt!"
345,"Man könnte annehmen, und es ist in älteren Zeiten angenommen worden, daß diejenigen Teile der Organisation, welche die Lebensweise und im allgemeinen den Platz bestimmen, welchen jedes Wesen im Haushalte der Natur einnimmt, von erster Wichtigkeit seien.",4,1,0,Metapher,"['im Haushalte', nan, 'der Natur', 'im Haushalte', nan]","['der Natur', nan, 'Haushalt', 'der Natur', nan]","['B', 'A', 'P', 'K', 'GoldStandard']"," »Man könnte annehmen, und es ist in älteren Zeiten angenommen worden, daß diejenigen Teile der Organisation, welche die Lebensweise und im allgemeinen den Platz bestimmen, welchen jedes Wesen im Haushalte der Natur einnimmt, von erster Wichtigkeit seien."
346,"Unter der ausschließlichen Herrschaft des Rechts des Stärkeren, sagt Tylor, würde ein Volksstamm in kurzer Zeit seiner Auflösung entgegen gehen. Es ergibt sich hieraus, daß ein Zusammenleben in einer Gemeinschaft stets gewisse Regeln oder Gebräuche voraussetzt, kraft deren den einzelnen Hordengenossen gewisse Schranken ihrer Tätigkeit gesetzt werden.",1,3,0,,"[nan, 'Auflösung entgegen gehen', nan, nan]","[nan, 'Volksstamm', nan, nan]","['B', 'A', 'P', 'K']"," »Unter der ausschließlichen Herrschaft des Rechts des Stärkeren«, sagt Tylor3), würde ein Volksstamm in kurzer Zeit seiner Auflösung entgegen gehen«. Es ergibt sich hieraus, daß ein Zusammenleben in einer Gemeinschaft stets gewisse Regeln oder Gebräuche voraussetzt, kraft deren den einzelnen Hordengenossen gewisse Schranken ihrer Tätigkeit gesetzt werden."
347,"Was das Wesen des Staates im allgemeinen betrifft, so müssen wir . . . ihm eine eigene reale Wesenheit zuschreiben. Er erscheint uns als ein menschlicher Gesellschaftsorganisums mit einem von dem Leben seiner Glieder verschiedenen einheitlichen Gesamtleben.",0,5,0,Metaphernkandidat,"[nan, nan, nan, nan, nan]","[nan, nan, nan, nan, nan]","['B', 'A', 'P', 'K', 'GoldStandard']"," »Was das Wesen des Staates im allgemeinen betrifft, so müssen wir . . . ihm eine eigene reale Wesenheit zuschreiben. Er erscheint uns als ein menschlicher Gesellschaftsorganisums mit einem von dem Leben seiner Glieder verschiedenen einheitlichen sellschaftsorganisums mit einem von dem Leben seiner Glieder verschiedenen einheitlichen Gesamtleben."
348,"Wir können den Lauf der Zeit nicht dadurch beschleunigen, daß wir unsere Uhren vorstellen ein Zukunftsgesetz, und wenn es die genialste Lösung der sozialen Fragen enthielte, es fände kein Land, wo es fußen, und kein Volksverständnis, in dem es wurzeln könnte, sagt Endemann.",4,1,0,Metapher,"['kein Land, wo es fußen, und kein Volksverständnis, in dem es wurzeln könnte', 'fußen, wurzeln', 'fußen, wurzeln', nan, 'kein Land, wo es fußen, und kein Volksverständnis, in dem es wurzeln könnte']","['ein Zukunftsgesetz', 'Land, Volksverständnis', 'Zukunftsgesetz', nan, 'ein Zukunftsgesetz']","['B', 'A', 'P', 'K', 'GoldStandard']"," »Wir können den Lauf der Zeit nicht dadurch beschleunigen, daß wir unsere Uhren vorstellen: ein Zukunftsgesetz, durch beschleunigen, daß wir unsere Uhren vorstellen: ein Zukunftsgesetz, und wenn es die genialste Lösung der sozialen Fragen enthielte, es fände kein Land, wo es fußen, und kein Volksverständnis, in dem es wurzeln könnte«, sagt Endemann1)."
349,"Zu Grunde gegangen ist, so urteilt Mommsen, wie der Römerstaat des Prinzipats, so auch der restaurierte Diocletians . . . nicht durch die Barbaren, sondern an innerer Fäulnis.",1,4,0,Metaphernkandidat,"[nan, 'innerer Fäulnis', nan, nan, nan]","[nan, 'Römerstaat', nan, nan, nan]","['B', 'A', 'P', 'K', 'GoldStandard']"," »Zu Grunde gegangen ist«, so urteilt Mommsen2), »wie der Römerstaat des Prinzipats, so auch der restaurierte Diocletians . . . nicht durch die Barbaren, sondern an innerer Fäulnis.«"
350,"Überall machen sich starke Bestrebungen geltend, die überkommenen Sitten und Gebräuche gegenüber der nagenden Vernunft aufrecht zu erhalten.",5,0,0,Metapher,"['nagende', 'nagenden', 'nagende', 'nagenden ', 'nagende']","['Vernunft', 'Vernunft', 'Vernunft', 'Vernunft', 'Vernunft']","['B', 'A', 'P', 'K', 'GoldStandard']"," Überall machen sich starke Bestrebungen geltend, die überkommenen Sitten und Gebräuche gegenüber der nagenden Vernunft aufrecht zu erhalten."
351,"Übrigens haben wir bereits im  Kapitel S. gesehen, daß einerseits die Rechenmanöver, die sich auf das Glück einer Gesellschaft beziehen, mit ebenso unüberwindlichen Schwierigkeiten zu kämpfen haben wie der Versuch, einen Regenbogen zu besteigen, und daß andererseits von dem Aussichtspunkt, den die Descendenztheorie gewährt, wahrnehmbar ist, daß Glücksempfindungen irgendwelcher Gruppe oder Summe von Personen nicht das Ziel der inneren Politik sein können, sondern ausschließlich die Anpassung an die Bedingungen, von denen für das Gemeinwesen der Sieg im Daseinskampf abhängt.",1,3,0,Metaphernkandidat,"[nan, nan, 'einen Regenbogen zu besteigen', nan]","[nan, nan, 'der Versuch', nan]","['B', 'K', 'A', 'GoldStandard']"," Übrigens haben wir bereits im 9. Kapitel (S. 235-240) gesehen, daß einerseits die Rechenmanöver, die sich auf das Glück einer Gesellschaft beziehen, seits die Rechenmanöver, die sich auf das Glück einer Gesellschaft beziehen, mit ebenso unüberwindlichen Schwierigkeiten zu kämpfen haben wie der Versuch, einen Regenbogen zu besteigen, und daß andererseits von dem Aus- such, einen Regenbogen zu besteigen, und daß andererseits von dem Aussichtspunkt, den die Descendenztheorie gewährt, wahrnehmbar ist, daß Glücks- sichtspunkt, den die Descendenztheorie gewährt, wahrnehmbar ist, daß Glücksempfindungen irgendwelcher Gruppe oder Summe von Personen nicht das empfindungen irgendwelcher Gruppe oder Summe von Personen nicht das Ziel der inneren Politik sein können, sondern ausschließlich die Anpassung an die Bedingungen, von denen für das Gemeinwesen der Sieg im Daseinskampf abhängt."
352,der Egoismus leitet die Gewalt unvermerkt in die Bahn des Rechts.,2,3,0,Metaphernkandidat,"[nan, 'Egoismus', 'leitet in die Bahn des Rechts', nan, nan]","[nan, 'leitet,in die Bahn des Rechts', 'die Gewalt', nan, nan]","['B', 'A', 'P', 'K', 'GoldStandard']", — der Egoismus leitet die Gewalt unvermerkt in die Bahn des Rechts.
353,"Wir können uns kaum der Annahme entziehen, daß die menschliche Natur . . . durch Ausscheidung und Auslese einer weiteren tiefen Veränderung unterzogen wird, daß in der Fähigkeit seiner Muskeln und noch mehr in der Denkkraft seines Hirns eine ungeheure Hebung eintreten wird ja daß sogar besondere soziale Eigenschaften mit Einschluß einer angeborenen Neigung zur Aufnahme sozialer Gebote, ohne die soziales Leben nun einmal unmöglich ist, der physischen Organisation der höchsten Rassen eingeboren werden können aber ohne Zweifel ist diese besondere Quelle des Fortschritts heute fast ganz verstopft. Dieser Nachsatz dürfte mit den Vordersätzen nur dann vereinbar sein, wenn Balfour die Möglichkeit im Auge hat, daß diese Quelle in der Zukunft nicht wie heute verstopft sein werde.",4,0,0,Metapher,"['diese Quelle ist fast ganz verstopft', 'verstopft; verstopft', 'fast ganz verstopft', nan]","['des Fortschritts', 'Quelle des Fortschritts; diese Quelle', 'Quelle des Fortschritts', nan]","['B', 'K', 'A', 'GoldStandard']"," „Wir können uns kaum der Annahme entziehen, daß die menschliche Natur . . . durch Ausscheidung und Auslese einer weiteren tiefen Veränderung unterzogen wird, daß in der Fähigkeit seiner Muskeln und noch mehr in der Denkkraft seines Hirns eine ungeheure Hebung eintreten wird; ja daß sogar besondere soziale Eigenschaften mit Einschluß geheure Hebung eintreten wird; ja daß sogar besondere soziale Eigenschaften mit Einschluß einer angeborenen Neigung zur Aufnahme sozialer Gebote, ohne die soziales Leben nun einmal unmöglich ist, der physischen Organisation der höchsten Rassen eingeboren werden können - aber ohne Zweifel ist diese besondere Quelle des Fortschritts heute fast ganz verstopft.“ Dieser Nachsatz dürfte mit den Vordersätzen nur dann vereinbar sein, wenn Balfour die Möglichkeit im Auge hat, daß diese Quelle in der Zukunft nicht wie heute verstopft sein werde."
354,"Die Natur selbst führt hier seine Experimente aus, die der Physiologie bei seinen künstlichen Versuchen nur teilweise oder gar nicht anzustellen imstande ist.",0,4,0,Metaphernkandidat,"[nan, nan, nan, nan]","[nan, nan, nan, nan]","['P', 'B', 'K', 'GoldStandard']","10	Die Natur selbst führt hier seine Experimente aus, die der Physiologie bei seinen künstlichen Versuchen nur teilweise oder gar nicht anzustellen imstande ist."
355,"In ähnlicher Weise hat sich die bewußte Psyche, eine innere Spiegelung der eigenen Seelenarbeit, als ein neues Lebenswunder aus der unbewußten Assoziationsarbeit im Phronema unserer älteren WirbeltierAhnen stufenweise und allmählich historische entwickelt.",0,4,0,Metaphernkandidat,"[nan, nan, nan, nan]","[nan, nan, nan, nan]","['P', 'B', 'K', 'GoldStandard']","12	In ähnlicher Weise hat sich die bewußte Psyche, eine innere Spiegelung der eigenen Seelenarbeit, als ein neues Lebenswunder aus der unbewußten Assoziationsarbeit im Phronema unserer älteren Wirbeltier-Ahnen stufenweise und allmählich historische entwickelt."
356,"Am einfachsten und am schnellsten wird der gordische Knoten dieser Frage gelöst, wenn man ihn mit dem Schwerte des frommen Glaubens durchschneidet und durch die Annahme einer übernatürlichen Schöpfung beantwortet.",5,1,0,Metapher,"[nan, 'der gordische Knoten', 'dem Schwerte', 'durchschneidet', 'Schwerte', ""['der gordische Knoten', 'dem Schwerte', 'durchschneidet', 'Schwerte']""]","[nan, 'dieser Frage', 'des ""frommen Glaubens""', nan, 'des ""frommen Glaubens""', '[\'dieser Frage\', \'des ""frommen Glaubens""\', \'\', \'des ""frommen Glaubens""\']']","['P', 'B', 'B', 'B', 'K', 'GoldStandard']","137	Am einfachsten und am schnellsten wird der gordische Knoten dieser Frage gelöst, wenn man ihn mit dem Schwerte des ""frommen Glaubens"" durchschneidet und durch die Annahme einer übernatürlichen Schöpfung beantwortet."
357,"Dann würden den Kulturkindern frühzeitig unerschöpfliche Quellen des feinsten und edelsten Lebensgenusses eröffnet werden, von denen der rohe Wilde noch keine Ahnung hat.",1,3,0,Metaphernkandidat,"['unerschöpfliche Quellen', nan, nan, nan]","['des feinsten und edelsten Lebensgenusses', nan, nan, nan]","['P', 'B', 'K', 'GoldStandard']","162	Dann würden den Kulturkindern frühzeitig unerschöpfliche Quellen des feinsten und edelsten Lebensgenusses eröffnet werden, von denen der rohe Wilde noch keine Ahnung hat."
358,Das Christentum hat die zehn Gebote des Moses aus der älteren jüdischen Religion übernommen und mit der mystischen Metaphysik des Platonismus zu einem mächtigen Moralgebäude vereinigt.,0,4,0,Metaphernkandidat,"[nan, nan, nan, nan]","[nan, nan, nan, nan]","['P', 'B', 'K', 'GoldStandard']","165	Das Christentum hat die ""zehn Gebote"" des Moses aus der älteren jüdischen Religion übernommen und mit der mystischen Metaphysik des Platonismus zu einem mächtigen Moralgebäude vereinigt."
359,"Unter diesen byzantischen Unsitten, die sich mit dem Mantel der Gottesfurcht schmücken, blüht der praktische Materialismus, während gleichzeitig der reine Monismus als theoretischer Materialismus verabscheut wird.",0,4,0,Metaphernkandidat,"[nan, nan, nan, nan]","[nan, nan, nan, nan]","['P', 'B', 'K', 'GoldStandard']","177	Unter diesen byzantischen Unsitten, die sich mit dem Mantel der ""Gottesfurcht"" schmücken, blüht der ""praktische Materialismus"", während gleichzeitig der reine Monismus als ""theoretischer Materialismus"" verabscheut wird."
360,"Die wichtige Theorie von der spezifischen Energie der Sinnesnerven, wie sie Johannes Müller aufstellte, schlägt hier die Verbindungsbrücke zwischen jenen zwei Welten.",1,3,0,Metaphernkandidat,"[nan, 'die Verbindungsbrücke zwischen jenen zwei Welten.', nan, nan]","[nan, 'Die wichtige Theorie von der ""spezifischen Energie"" der Sinnesnerven', nan, nan]","['P', 'B', 'K', 'GoldStandard']","185	Die wichtige Theorie von der ""spezifischen Energie"" der Sinnesnerven, wie sie Johannes Müller aufstellte, schlägt hier die Verbindungsbrücke zwischen jenen zwei Welten."
361,So pflanzt sich das nämliche geistige Band durch alle materiellen Erscheinungen fort.,1,3,0,Metaphernkandidat,"['pflanzt sich', nan, nan, nan]","['geistige Band', nan, nan, nan]","['P', 'B', 'K', 'GoldStandard']",187	So pflanzt sich das nämliche geistige Band durch alle materiellen Erscheinungen fort.
